{
  "event_id": "33333333-3333-4333-8333-333333333333",
  "event_type": "order.submitted",
  "schema_version": 1,
  "tenant_id": "11111111-1111-4111-8111-111111111111",
  "aggregate_type": "order",
  "aggregate_id": "44444444-4444-4444-8444-444444444444",
  "aggregate_version": 2,
  "occurred_at": "2026-10-04T12:00:00Z",
  "actor_ref": "principal:synthetic-requester-1",
  "causation_id": "55555555-5555-4555-8555-555555555555",
  "correlation_id": "66666666-6666-4666-8666-666666666666",
  "traceparent": "00-4bf92f3577b34da6a3ce929d0e0e4736-00f067aa0ba902b7-01",
  "payload": {
    "supplier_id": "77777777-7777-4777-8777-777777777777",
    "evidence_digest": "sha256:aaaaaaaaaaaaaaaaaaaaaaaaaaaaaaaaaaaaaaaaaaaaaaaaaaaaaaaaaaaaaaaa"
  }
}
